{
  "schema_version": 1,
  "course_id": "campaign-performance-brief",
  "g5_status": "PASS",
  "g6_state": "READY_TO_PUBLISH",
  "published": false,
  "checks": [
    {
      "id": "technical",
      "result": "PASS",
      "evidence": {
        "path": "evidence/release-technical.json",
        "sha256": "4f077a4f167d80beb4266692b305b88b0f711e25d699a6366a9a454b5e96cca2"
      }
    },
    {
      "id": "links",
      "result": "PASS",
      "evidence": {
        "path": "evidence/release-links.json",
        "sha256": "18f925171508d10927dcce449347fca470cf743cb982ee9a950d8fe26723aeb5"
      }
    },
    {
      "id": "registration",
      "result": "PASS",
      "evidence": {
        "path": "evidence/release-registration.json",
        "sha256": "3289423238e37b48677f2f2cd3ee0a6eb94a0788d5863e8d37056e1c9ee84e27"
      }
    },
    {
      "id": "access",
      "result": "PASS",
      "evidence": {
        "path": "evidence/release-access.json",
        "sha256": "5bc9cbd8578479de4cbabae3f4b2765f2885a1b7bc6033f0d91018e49be682ab"
      }
    },
    {
      "id": "rollback",
      "result": "PASS",
      "evidence": {
        "path": "evidence/release-rollback.json",
        "sha256": "c1f99853632744955e2c088503a0a69b2bff27d862c373a452952ad17e5d30d6"
      }
    },
    {
      "id": "maintenance",
      "result": "PASS",
      "evidence": {
        "path": "evidence/release-maintenance.json",
        "sha256": "c474de96c9f10c15c47c0d7737400073d691b944bb9b6d51dcc6e869d654bd28"
      }
    }
  ],
  "changes": [
    {
      "source_path": "release-staging/index.html",
      "target_path": "release-target/index.html"
    }
  ],
  "maintenance": {
    "owner": "course-ops",
    "cadence": "quarterly",
    "freshness_sources": [
      "Google Ads official help pages",
      "learner trial issues"
    ],
    "next_review": "2027-01-18"
  }
}
